{
  "$schema": "urn:docwen:schema:resolved-document:v1",
  "schema": "docwen.resolved_document.v1",
  "input_id": "document-1",
  "source_sha256": "e3b0c44298fc1c149afbf4c8996fb92427ae41e4649b934ca495991b7852b855",
  "plan_sha256": "1111111111111111111111111111111111111111111111111111111111111111",
  "document": {
    "authored_markdown": "",
    "targets": [],
    "references": [],
    "resource_occurrences": [],
    "citations": [],
    "resources": []
  }
}
